StatementId,Text
1285b719b23d7a5e6a0f28044ef20e35,"@PavelBelobradek Tak, pro캜 m치m pocit, 쬰 pro KDU-캛SL je t칠ma Kalousek pouze osobn칤?"
15e806036104cabaaf1b979884fe7df1,"A to mnoz칤 netu코칤, hlavn캩 Kalousek, Jel칤nek a mnoz칤 novina콏i, a캜 jsou to neurologov칠 amat칠콏i, 쬰 uva쬿ji, narozd칤l od Honzy, 쬰 pl치nuji n치vrat!"
1635ff1ccddda1c7dbbe039cd725603b,"@spicy_haggis @DeveraPetr @jindrichsidlo @ondrej_m @EduardHulicius @michalblaha @grunfeldpavel @TomZdechovskyEP @Tom57467060 @Pater_JanSpacek @TomZdechovsky @1PavelSvoboda @msojdrova @kducs @Pospisil_Jiri N캩jak mi ned치v치 smysl takovou stranu nejd콏칤ve rozb칤t, poslat mimo sn캩movnu, zvracet na ni systematicky a kdy to hroz칤 m캩 samotn칠mu, 쬰 m캩 vysaj칤 Pir치ti, cht칤t se spojovat. 칔캜elovka, pokrytectv칤? A Kalousek cht캩l loni blok s ODS a n치mi bez STAN. Pro캜 asi? Te캞 to m치 TOP jinak 游"
1f18c2c546859467f562d1e29e5f6909,"@Kamiok6 @tomio_cz @YouTube @MarekVyborny ten nebyl u Sude콘치k콢, p콏ece. Kalousek taky nen칤 p콏edseda strany;-)"
2ab8362e9c583f42a8671083703488d7,"@beny089 Nejde o voli캜e? To je vtip? Nav칤c nejde jen o na코e. N캩komu vad칤 Kalousek, n캩komu lidovci, n캩komu Klaus콢v mechanismus atd. Podce켿ujete lid칤, nesu캞te podle sebe. Opozice funguje, jen m치 men코inu"
38585f3678d88192d2a0f654afee692b,"@MarekVondrak @MiBBMa @HIbidem Jen rikam, jak je medialne prezentovan i Kalousek. Nejen Jurecka. Ze medialne pospinit a manipulovat, posouvat je jednoduche"
4809b965301a845cdd0c099c72de7dd8,"@PetrMestecky @BlanikZ @jindrichsidlo @kalousekm Jste 칰pln캩 mimo, M. Kalousek vylou캜il tehdy STAN. Pokud by 코lo o spojeni 캜ty콏 stran v캜etn캩 ODS, je to n캩co jin칠ho, ale o tom tady nebyla 콏e캜!!! To smysl d치v치!!, a캜 to je hodn캩 divok칠. A kdy p콏ibereme Pir치ty, vznikne jednotn치 kandid치tka N치rodn칤 antibabi코 fronty! To u zn치me 游땔"
4fc459e2b59d9eebc3a57d3223c70b9b,"@TenMikulas @MarieS345 @Jag1George @ODScz @TOP09cz Vse je v behu, jen to neni online. Uvidime, kak to dopadne. Jurecka je neopravnene demonizovan jako Kalousek, nebo Topolanek."
50a3197063472facdcdc699283f93dd0,"@Pupowski @msojdrova @PeszynskiTomasz @david_klimes @kducsl @STANcz @TOP09cz @Telicka @StetinaEP @AndrejBabis @ODScz @PiratskaStrana @TomZdechovsky @TomZdechovskyEP @1PavelSvoboda To jste mimo. V roce 2010, 2013 ani 2017 o tom nebyla 콏e캜. Pouze M. Kalousek navrhl spole캜nou kandid치tku ODS, topky a n치s (bez STAN!!!). Prost캩 dokud to bylo v칳hodn칠, bral hlasy ODS, kdy se roze코el se STAN, cht캩l je vyt캩snit a s치m se zachr치nit, tak mu ODS a my byli dob콏칤."
52c0a23cc30b97eea82ddbf332e9f152,"Kalousek nejd콏칤ve prav칳 st콏ed rozd캩lil, vyloupil hlavn캩 ODS a tro코ku n치s, pomluvil n치s a pozur치쬰l (te캞 se mu to vrac칤 od Pir치t콢) a kdy mu teklo do bot, za캜al mluvit o sjednocen칤. Jemu to p콏eci nikdo nemohl v캩콏it. Douf치m, 쬰 nov칠 veden칤 topky to vezme za jin칳 konec. https://t.co/ysYLiLsUEL"
566ce424f33c03519793de8900180ff8,"Nejsem p콏edseda a za KDU-캛SL nemluv칤m.    Moc n캩kter칳m lidem nerozum칤m. Kdy n치s M. Kalousek ur치쬰l a pomlouval, nel칤bilo se mi to. Kdy to d캩laj칤 jemu, kritizuji to tak칠 a 콏칤k치m, 쬰 nov칠 veden칤 topky to snad vezme za jin칳 konec. Co je na tom 코patn칠ho? Nebo kdy to d캩lal on, bylo to v po콏치dku a jemu, kdy se d캩l치 to sam칠, je to blb캩? J치 tedy mysl칤m, 쬰 코patn캩 to je v obou p콏칤padech a ne 쬰 on je OK a Pir치ti ne. Proto쬰 to komplikuje jedn치n칤.r치ti stejn캩 spolupracovat necht캩j칤, co u deklarovali. Naposledy jsem v rozhovoru v MfD 콏ekl, 쬰 j칤t SAMOSTATN캨 JE a posledn칤 콏e코en칤. A JAK JSEM PSAL, SNAD TO MARK칄TA P콎EKLENE. Mirek v코echny pozur치쬰l a to mu ur캜it캩 lze odpustit. Ale ne zapomenout.  Jestli jste schopen d캩lat byznys s n캩k칳m, kdo V치s pomlouv치 a nikdy to nep콏izn치,  tak jste frajer. Naprosto nech치pu, jak chyt콏칤 lid칤 v콢bec nerozum칤 tomu, co jsem napsal. 콯e MK jen skl칤z칤 bou콏i,  kterou s치m zasel. 콯e je stejn칳 jako pan Mich치lek. A 쬰 on na to u snad nebude m칤t vliv, aby mo쬹치 spolupr치ce neskon캜ila kv콢li n캩mu.    V dob캩 na코eho vstupu do vl치dy se o Stb A. Babi코 soudil. Nav칤c ho akceptoval prezident a premi칠r. Na rozd칤l od M. Kalouska jsem p콏iznal, 쬰, 쬰 to byla chyba a dnes bych do takov칠 vl치dy ne코el. A TAKY JSEM TO UK츼ZAL V PRAXI.     A jeho kritiku vl치dy s AB nemysl칤m, MK v코echny pomluvil a pozur치쬰l. Jde o jin칠 a star코칤 v캩ci. T칳k치 se to nejen n치s v jin칳ch kauz치ch 2009-2019. Ale i Pir치ty, ODS a STAN. To, co dlouhodob캩 d캩lal, samoz콏ejm캩 po코kodilo vztahy k n캩mu od koleg콢 z jin칳ch stran. Taky v TOP09.   A j치 douf치m, 쬰 u nebude ve veden칤 topky figurovat a nov칠 p콏edsednictvo topky bude slu코n캩j코칤."
57a75c61071cddb723b92e2555c3c7d3,"@PetrSvoby97 @PetrHonzejk @kducsl @STANcz @TOP09cz @cducsubt @oevpklub Jen쬰 takov칳ch jako vy je podstatn캩 m칠n캩, nez tem, kter칳m to vad칤. A neodrazuj칤 jen 캛unek a Kalousek."
7c753a02b712d2eb8f3dd4dc404252e1,"Ch치pu, pro캜 se Mirek a voli캜i Topky 캜ert칤. Ale asi u zapomn캩li, jak se Mirek vyjad콏oval o jin칳ch stran치ch s치m. Jen mu to te캞 d캩laj칤 jin칤. Spr치vn칠 to nen칤. A nebylo ani od Mirka. Kalousek nejd콏칤ve prav칳 st콏ed rozd캩lil, vyloupil hlavn캩 ODS a tro코ku n치s, pomluvil n치s a pozur치쬰l (te캞 se mu to vrac칤 od Pir치t콢) a kdy mu teklo do bot, za캜al mluvit o sjednocen칤. Jemu to p콏eci nikdo nemohl v캩콏it. Douf치m, 쬰 nov칠 veden칤 topky to vezme za jin칳 konec."
873aad35f24c7feb66bef3a27b23e4c1,"@MarekVondrak @t_koudelka Spol칠h치me na inteligenci sv칳ch voli캜콢. M. Kalousek prohl치sil ne-ne v kraj칤ch a te캞 s ANO topka sed칤 v Jmk"
877c37da16ce7ab6cac983a96c51d21f,"@MarekVondrak @MiBBMa @HIbidem A pro캜 m치 M. Kalousek n치lepku jakou m치? V bingu ji nevyhr치l. Prost캩 se v politice 코pin캩n칤 a p콏ekrucov치n칤 pou쮂셨치. Nejen na M. Kalouska"
a0431ac1827d3676bec09fc688c80ee7,"@michalblaha @EduardHulicius @ondrej_m @t_koudelka @josefslerka @jindrichsidlo @DeveraPetr @grunfeldpavel @TomZdechovskyEP @Tom57467060 @Pater_JanSpacek @TomZdechovsky @1PavelSvoboda @msojdrova @kducs @Pospisil_Jiri Bych 콏ekl, ze ano. Ze nejde jen o demokracii, ale hlavn캩 o z치chranu topky pred vys치t칤m PS a ODS. Ze ti sami lide nevolali po integraci v roce 2010, 2013...ano, Kalousek u tu코il, ze to bude t캩sn칠 a navrhoval ODS, TOP a my. Samoz콏ejm캩 vynechal neposlu코n칳 STAN游땦"
ae10cb89b6206a9c3556e7355f698d3c,"@josefslerka @jindrichsidlo @ondrej_m @DeveraPetr @EduardHulicius @michalblaha @grunfeldpavel @TomZdechovskyEP @Tom57467060 @Pater_JanSpacek @TomZdechovsky @1PavelSvoboda @msojdrova @kducs @Pospisil_Jiri Velkorysost nechyb칤. Neple콘te ji s racionalitou. Velkorys칳ch je prost캩 men코ina na코ich voli캜콢. P. S.  Ja jsem velkorysost sama. Pozvat M. Kalouska na n치코 sjezd atd. A on nas tam pozvracel..."
ae2a41080e90000b5d2f888b339bee29,"Prymula: Je u n치s 2. vlna. Jsme 3. nejzasa쬰n캩j코칤 zem칤 EU.  Kalousek: Zemi 콏칤d칤 bl치zniv칳 chlap.  Zaor치lek: Obnovit krizov칳 코t치b.  Babi코 ve vagonu se zata쬰n칳mi z치clonkami: 콯치d치m m칠dia, aby p콏estala stra코it lidi! V캜era s covidem nezem콏el nikdo!   Takov칳 코v칠dsk칳 st콢l. Vybere si ka쬯칳."
b49298fcb61bfb22ea6c87c6d4771357,"@Novak_Jar @ondrej_m @DeveraPetr @EduardHulicius @michalblaha @grunfeldpavel @TomZdechovskyEP @Tom57467060 @Pater_JanSpacek @TomZdechovsky @1PavelSvoboda @msojdrova @kducs @Pospisil_Jiri Chce to jen 캜치st voli캜콢. Ta men코칤. Prost캩 se s t칤m smi콏te, 쬰 jste z t칠 men코칤 캜치sti, kter치 si spojen칤 캛unka s Kalouskem (uv치d칤m jako iracion치ln칤 symboly) um칤 p콏edstavit. V코ichni tam neskon캜칤me. Koalic칤 t칠m캩콏 jist캩 v코echny t콏i. A to je pointa. A topka se muze spojit s Piraty, ne?"
c01a50d5d5d5ddec734e1dad512229b6,"Kupodivu odchod Kalouska ze Sn캩movny se zat칤m v moj칤 twitterov칠 bublin캩 콏e코칤 m치lo. Tak poru코칤m p콏edsevzet칤 tu nekomentovat 캜eskou politiku, a trochu to nakopnu. Po velk칠 trojce (Havel, Klaus, Zeman) je pro mne Mirek Kalousek prvn칤 v 콏ad캩 s titulem skute캜n칳 politik. Bude chyb캩t !"
c95d1d40db9f67fb626bc34280fe34c2,"@PetrSvoby97 @EPP Ty same jako Posp칤코il, Gazd칤k, Pol캜치k, Kalousek, Juncker, Merkelov치 a Berlusconi"
d3d1dd2ef075b292f427ee42c1b61a5b,"Pir치ti vytvo콏ili mlhu pro Babi코e, c칤t칤 se ohro쬰n칤 a posiluj칤 ho, ten se te캞 mus칤 za b콏icho popadat. Kalousek cht캩l sjednotit opozici u d콏칤ve a byl ochoten v t칠 spolupr치ci nefigurovat, 콏칤k치 Mark칠ta Pekarov치 Adamov치, p콏edsedkyn캩 TOP 09.   https://t.co/VmbJ7k3UUY"
d514bece659122905516bf0f668a685f,"@MarekVondrak @MiBBMa @HIbidem To same se da rici o M. Kalouskovi"
d81d5a0a674ab624feef21d3626b79a0,"@PepaKopecky Pak v칤te, 쬰 v 캛r vl치du netvo콏칤 jen minist콏i. J치 nikdy ministrem nebyl. Va코칤 pr치ce si v치쮂셠, pat콏칤te k 코pi캜ce. Ale tohle je opravdu zav치d캩j칤c칤 a nep콏esn칠. Uznaz chybu nen칤 hanba. V tomto p콏칤pad캩 to p콏ed p치r uznal l칠ty i M. Kalousek, 쬰 jsem ministrem opravdu nebyl."
dabb2afe7ac608c211610cc090afd017,"@michalblaha @DeveraPetr @TomZdechovskyEP @Tom57467060 @Pater_JanSpacek @TomZdechovsky @1PavelSvoboda @msojdrova @kducs Proto쬰 by se koalice musela dostat p콏es 10, resp. 15%. A to by se nejsp칤코e nedostala. Tolik na코e tvrd치 data z roku 2017. V칤ce bylo t캩ch, kter칠 koalice odrazovala, ne oslovila. Nap콏.  캛unek a Kalousek odrazuj칤, i kdy v콢bec nekandiduj칤. Samostatn캩 je z콏ejm캩 v칤c %, ne dohromady"
eac501dfd822b7f6e023c6577854d2ba,"@Novak_Jar @ondrej_m @DeveraPetr @EduardHulicius @michalblaha @grunfeldpavel @TomZdechovskyEP @Tom57467060 @Pater_JanSpacek @TomZdechovsky @1PavelSvoboda @msojdrova @kducs @Pospisil_Jiri Jen쬰 oni nejsou jinde jen region치ln캩, ale i hodnotov캩. Dopl켿uj칤 se tedy jen teoreticky a prakticky to nefunguje. Co v칤me po zku코enosti se STAN. Brut치ln칤 zkratkou: 캛unka s Kalouskem (strany) v칤ce voli캜콢 neocen칤, ne hodnotu spojen칤. Odpuzuj칤 v칤c ne p콏inesou, i kdy nekandiduj칤."
ed18bc2994f375065dd2d6d366253126,"M. Kalousek nen칤 probl칠m pro l칤dry ostatn칤ch stran, ti jsou schopni se p콏es mnoh칠 코r치my p콏en칠st, ale z치sadn칤 je to pro jejich voli캜e. Co je objektivn캩 dolo쬴teln칠. A s t캩mi se holt mus칤 po캜칤tat, voli캜e nelze ignorovat. Nen칤 to osobn칤, ale racion치ln칤."
ff5976a541d324eee64d28caaef676ff,"@hokic @PetrHonzejk @david_klimes @jindrichsidlo Pro캜 ne, kdy to voli캜i budou cht칤t. Zat칤m je evidentn칤, 쬰 snad mimo Prahu to v칤ce lid칤 nechce, ne p콏it치hne. Tak쬰 to je zat칤m bezp콏edm캩tn칠. Nebr치nil bych se ani velk칠 koalici  ODS, topky, STAN a n치s. Na rozd칤l od M. Kalouska tedy i se STAN. I Pir치ty, a콘 m치me mand치t콢 je코t캩 v칤c!"
