StatementId,Text
A3AD685277BF38FBFD71E8B8B81EDEE9,"Zákon o střetu zájmů řeší hlavně střet zájmů Andreje Babiše. Není důvod to nepřiznat. Zákon „o jednom člověku“ není ideální. Přesto je potřebný. Nejsme v normální situaci a proto musíme volit nestandardní cesty. ODS nejde o politické divadlo, ale o efektivní ochranu občanů před oligarchy a všemi, kteří zneužívají moc ve svůj prospěch. Proto jsme zákon podpořili.    Andrej Babiš je od vstupu do vlády ve střetu zájmů. Má firmy, které čerpají státní dotace, pobídky, účastní se veřejných soutěží. Vlastní média, čímž negativně ovlivňuje podmínky pro demokracii a rovnou soutěž politických stran. Všichni to ví. ČSSD to dlouho nevadilo, nám ano. ČSSD vytvořila s Andrejem Babišem vládu a premiér Sobotka ho tam drží, ať A. Babiš udělá cokoli. Před veřejností hrají divadlo, hádají se, urážejí se, ale jinak si rozumějí. Hlasují spolu pro úplné nesmysly a mají společného nepřítele: malé a střední podnikatele, všechny aktivní lidi, kteří chtějí žít svobodně. Původní návrh zákona ostatně nemířil na ty „velké“, ale na starosty. V logice vládní úvahy, že všichni jsou podezřelí.   Vládní ČSSD i KDU-ČSL ale mezitím vytušily, že i je A. Babiš ohrožuje. Najednou na argumenty pravicové opozice slyší. Objevila se šance Andreje Babiše aspoň do budoucna omezit. Takovou šanci nelze promarnit. Zákon o střetu zájmů není proti majetku a soukromému vlastnictví, je naopak pokusem bránit jeho zneužití pro politické cíle. Je ochranou občanů proti zneužití moci. ODS bez velkého křiku i bez pokryteckého a alibistického mlžení podpořila svými hlasy zákon, který reaguje na skutečný problém, jenž máme. To je správná a odpovědná pravicová politika."
A3E3C9092377418760A43CF2AF0F38FA,"Včera jsem se při parlamentních interpelacích ptal premiéra Bohuslava Sobotky, jestli si uvědomuje, co všechno mohou daňové nápady jeho ČSSD způsobit. Jak například vysvětlí špičkovému lékaři s platem kolem 60 tisíc - a snad se shodneme, že si takový plat zaslouží -, že po daňových změnách by přišel o cca. 2500 měsíčně, neboli 29 tisíc ročně? Premiér odpověděl vyhýbavě. Ale téma se evidentně ujalo :-)"
A3E78691BFB3EA5C370913FED4DF5931,"Slova volebního lídra ČSSD Lubomíra Zaorálka o  darebáctví podnikatelů  jsou jak z dob před rokem 1989. Je to urážlivé a vlastně i pokrytecky drzé. Kdyby to L. Zaorálek myslel se zvyšováním mezd vážně, neměl se uplynulé čtyři roky jako ministr Sobotkovy vlády podílet na zavádění dalších a dalších regulací a překážek pro podnikatelskou sféru. Každá regulace něco stojí, nejen stát, ale i zaměstnavatele - a doplácíme na to všichni. Dobrý podnikatel by svým zaměstnancům vyšší mzdy rád platil. Místo toho ale musí dávat peníze na byrokratické nesmysly, které uplynulé čtyři roky podporoval ve vládě i ministr Zaorálek."
A54CC01E3B398D26B097070267B9C1B5,"Kontrolní hlášení DPH je absolutně nepřipraveným experimentem, což dokazují i čísla. Podle informací Hospodářských novin v řádném termínu nepodaly kontrolní hlášení DPH desetitisíce subjektů (110 000 z 300 000). Podle přijatého zákona tak desetitisícům podnikatelů hrozí vysoké pokuty. Dobrou zprávou je, že finanční správa ihned přispěchala s informací, že ti, kteří nestihli kontrolní hlášení DPH odevzdat v řádném termínu, nebudou trestáni. I to však svědčí o tom, že zákon o kontrolním hlášení DPH je legislativním zmetkem, který nepřinese nic jiného, než komplikace podnikatelům. Pánové Sobotka a Babiš měli díky nám šanci včas svoji chybu napravit. Nevyužili ji a za tento zmetek a zmatek mají plnou odpovědnost."
A7CEF474BC4474D16315FFE001A8765B,"Čtyři dny cirkusu a jsme tam, kde na začátku. Hanebné hazardování s pověstí české politiky doma i v zahraničí. Sobotka udělal to, co měl udělat už hodně dávno a nejpozději před půl rokem."
AF3227BC5CE65591CC1EC86A151DAB4C,"O tom, co nabízíme voličům, co je hlavním tématem ODS a proč chceme získat ve volbách co nejsilnější mandát. O tom, jestli se všem politikům měří stejným metrem - včetně Andreje Babiše a Bohuslava Sobotky... A také o tom, proč jsou v politice důležitější činy než řeči. O tom všem i dalších zajímavých tématech byl rozhovor, který se mnou vedl Luboš Xaver Veselý. A i když to byly vážné věci, občas jsme se taky docela zasmáli :-)"
B19A9A8E0B024F0543EA7143F7075088,"Selhání vlády v kauze úniku informací z bezpečnostních složek státu nelze vysedět ani zamést pod koberec. Premiér Bohuslav Sobotka by měl přijmout odpovědnost, k situaci se postavit čelem a Martina Stropnického odvolat. Není omluvitelné, aby ministr obrany před bezpečnostními zájmy České republiky upřednostňoval svůj osobní mediální obraz. V některých situacích musí ministr mlčet, aby neohrozil bezpečnost českých občanů. Martin Stropnický toho není schopen, proto je jeho pozice ministra neudržitelná. Jsem rád, že stejný názor zastává i vicepremiér Bělobrádek. Předseda vlády musí situaci urychleně vyřešit."
B1F16E37583949323F6DE79CFEA49007,"V uplynulých dnech se objevilo několik vážných podezření týkajících se hejtmana Jiřího Zimoly (ČSSD). Týkají se nestandardního nákupu pozemku a stavby rekreačních objektů v Lipně nad Vltavou, z nichž jeden je určen i pro jihočeského hejtmana Jiřího Zimolu (ČSSD), další pak pro jeho náměstka Jaromíra Slívu (ČSSD).   Zároveň se začaly šířit informace, že hejtman Zimola byl předem informován o policejním zásahu v kauze pražské Technické správy komunikací (TSK) a pokoutným způsobem se domlouvá na veřejných zakázkách v Jihočeském kraji.   Přestože podezření v uplynulých dnech přibylo, hejtmanův stranický předseda Bohuslav Sobotka ve svých veřejných vystoupeních kauzu ignoruje a tváří se, jako by se jej netýkala.      Vyzývám premiéra a předsedu ČSSD Bohuslava Sobotku, aby hejtmana za svoji stranu přiměl k věrohodnému vysvětlení těchto závažných podezření, která vrhají stín nejen na fungování Jihočeského kraje, ale i vrcholnou politiku jako takovou."
B2613083A956C7D55C7AEAA7C64AF21F,"Na koaliční radu nedorazili dva ze tří předsedů stran. Jednání to bylo asi jednoduché a přineslo nepochybně shodu premiéra Sobotky s premiérem Sobotkou. To není koaliční rada, ale koaliční fraška."
B7F1B9ABB53EEF94407E15CF541C5CBC,"Andrej Babiš zvolil nejlacinější strategii. Nic nevysvětlil a schoval se za své děti. Premiér Sobotka musí jednat. #ČapíHnízdo"
B9D393B68A6412C661BA2F3078D03CD5,"V české politice se začalo nenormální vydávat za normální. Myslím, že v budoucnosti se budou lidé divit, jaká byla v naší době politika podivná.  Patřím mezi ty, kteří se snaží politice vrátit smysl, zároveň jsem měl možnost pozorovat „z první řady“  sebedestrukci vlády Bohuslava Sobotky, ohýbání ústavy prezidentem Zemanem a premiérem Babišem, jejich vládu bez důvěry zato s podporou politických extrémistů  i schválení Babišovy „slučovací“ levicové vlády, která se opírá o komunisty.   Tak vznikla kniha „Jak uvařit demokracii“. Rád se s Vámi uvidím na autogramiádě v Brně a těším se debatu o současné politice."
BFB2A230934484EE5B2D04933D49F342,"Se slovy premiéra Sobotky, že si nepřeje, aby se u nás „nějaká silná muslimská komunita vytvořila“, lze jen souhlasit. Těžko s tím mohu mít problém, když to říkám už dlouho, že ano. Zakopaný pes je ale jinde. Slova nestačí, předseda vlády pro to může a musí něco udělat: neakceptovat kvóty, odmítnout návrhy na sjednocení azylové a migrační politiky a požadovat v této věci pro Českou republiku výjimku. Není to tak složité a těšilo by se to u nás většinové podpoře napříč politickým spektrem. Premiér o takovou podporu nežádá, setkání představitelů demokratických stran k české pozici v EU, ke kterému jsem ho vyzval, nesvolal. Těžko myslet, že se ostatních politiků bojí. Spíše je to tak, že v Bruselu nic prosazovat nechce. Tedy vlastně tu společnou armádu, ale v tom mu vážně pomáhat nebudeme. Pan premiér rázně promluvil, jak tu „ty muslimy“ nechceme, ale jeho vláda dělá kroky, které je sem nakonec přivedou. To je skoro lepší mlčet, jak to dělal dosud."
C0963A923A3BBC1404EF14C3925E11C3,"Nedávno jsem slíbil, že zhodnotíme, co vládní koalice pánů Sobotky, Babiše a Bělobrádka udělala – a neudělala – pro lidi a naši zemi. Tady je první hodnocení. Je třeba přiznat, že jedna věc se jim podařila: vytvořit mlhu o úspěšné vládě v oblasti ekonomiky. Pokud se ale mlha rozplyne, skutečnost je jiná. Více v mém novém videu..."
c137009e7d9f9fe6a1af4f1fce54269c,"Po měsících politického cirkusu, chaosu a ostudy, kterou nám předváděly vláda, koaliční strany a Hrad, chceme vrátit politickou diskusi tam, kam patří v tomto období necelých pět měsíců před volbami. Uznávám, že to byl dobrý pokus od spícího premiéra a předsedy ČSSD Bohuslava Sobotky i od programově bezradného předsedy ANO Andreje Babiše, jak zdůvodnit svoji existenci a vytvořit zdání něčeho podstatného. Ale byl to jen pokus. Teď nastal čas správnými slovy nazvat to, co se tu vlastně měsíce dělo – že nešlo o žádnou vládní krizi, ale o chaos a ostudu.   Je na čase vrátit se k tomu podstatnému v politice: tedy co kdo chce a co je kdo i schopen a kompetentní udělat pro naši zemi, pro lidi, pro lepší život. ODS se proto v červnu vrací k tomu, co jsme započali naší dubnovou programovou konferencí. Budeme pokračovat především v rámci naší kampaně za nižší daně a vyšší platy, v kampani za méně byrokracie a více svobody. Protože to jsou oblasti, které lidi zajímají."
c5fc308058ee41a8166392b55b9a9cb3,"Od začátku říkáme, že jediné normální řešení současné krize jsou předčasné volby. Nemá smysl se dalších pět měsíců dívat na to, zda bude ministrem Andrej Babiš nebo nějaký jeho  podbabiš  a sledovat náhlé zásadové postoje premiéra Sobotky, kterému tři a půl roku nic nevadilo, nic neviděl a nic s tím nedělal.  Mohl bych mít radost z toho, že si premiér a vicepremiér dělají čím dál větší ostudu, ale radost z toho nemám. Politici jsou zodpovědní i za to, co si o politice myslí lidé. Tento cirkus považuji za urážku voličů a občanů.   Volby a politika ve zdravé a stabilní zemi mají být soubojem idejí a programů, aby si voliči mohli vybrat ta řešení, která se zabývají skutečnými problémy lidí - aby se tu lépe žilo, lépe pracovalo a lépe podnikalo. Tyto volby budou velmi důležité a nesmíme dopustit, aby se z nich stalo trapné divadlo. Divadlo, které překryje ideovou vyprázdněnost a nulový program jeho aktérů. Celé je to kampaň. Kampaň proti zdravému rozumu."
CA1AC3CCC9EAA3BE7303852D21B1D7AE,"Země EU nedávají dost peněz na obranu, nechrání dost vnější hranice, nedělají, co je potřeba k zajištění bezpečnosti v nebezpečném světě. Řešení premiéra Sobotky? Evropská armáda. Je to nejen utopie, ale i odkládání problémů. To budeme desetiletí jednat o nových strukturách, velení, úřadu, umístění, akvizicích, názvech, hodnostech a o všem možném, co koho v Bruselu či jinde napadne? Český premiér se upíná k utopickému projektu, pro který nejsou v EU podmínky a ani žádný důvod. Jde o typický bruselský postup: skutečné problémy se řeší tak, že se neřeší a místo nich se vytvoří nové problémy. Myšlenka společné armády aktuální bezpečnostní situaci nezlepší ani o kousek. Od českého premiéra očekávám jasné slovo k zajištění obrany a bezpečnosti našich občanů a co pro to konkrétně jeho vláda udělá a ne eurofederalistické utopie, které nikomu nepomohou. Místo naivních nápadů je potřeba jít pragmatickou a rychlou cestou: rozvíjet spolupráci v rámci NATO a splnit závazek, že 2 % HDP půjdou na obranu."
caaaff15c96c29148b9a88caea84ec8f,"Dnes jsem se sešel s předsedou dolní komory rakouského parlamentu, panem Wolfgangem Sobotkou.   S Rakouskem nás pojí pevné historické vazby a jsme společně součástí evropského společenství.   Považuji za důležité rozvíjet už tak výborné vztahy mezi našimi zeměmi. https://t.co/t6QVWl80RZ"
cd0896f2292272fe07e19ff481b002a2,"Přemysl Sobotka. Legenda liberecké, ale i celostátní ODS. Dlouholetý senátor, předseda Senátu, nyní krajský radní pro zdravotnictví. Po letech ve vysoké politice se již rozhodl nepokračovat a užívat si zaslouženého odpočinku. Dnes jsem mu poděkoval za jeho práci pro ODS. https://t.co/KhtWKwPMmi"
d289b6eee1336749d8f13790dd31d00f,"Premiér Sobotka chce využít #PanamaPapers k ještě větší represi. My navrhujeme zjednodušení a snížení daní. Včetně toho, že některé zrušíme."
D2DBF6E2888CC3E53138B6F92A383C14,"Pokud jste včera nestihli mou debatu s premiérem Bohuslavem Sobotkou, její záznam naleznete zde: http://www.ceskatelevize.cz/porady/1126672097-otazky-vaclava-moravce/216411030500918/"
D7040A279CAA9F702C8045F5976DFF3C,"Premiér Bohuslav Sobotka se teď najednou snaží tvářit jako obránce poctivých podnikatelů. Nebyla to ale snad jeho vláda, kdo tu přes tři roky vymýšlel různé překážky pro podnikatele a živnostníky, které pro některé byly i likvidační? Kdo tu zaváděl EET, kontrolní hlášení atd.? Byla to vláda Bohuslava Sobotky s ministrem financí Andrejem Babišem a dalšími. Byla to koalice ČSSD, ANO a KDU-ČSL. Na to bychom neměli zapomínat."
d7883176eee970d105ea716233039488,"Koalici pánů Sobotky, Babiše a Bělobrádka se podařilo vytvořit mlhu o úspěšné vládě v oblasti ekonomiky. Skutečnost je ale úplně jiná. Vláda navzdory mnohaleté konjunktuře řídí stát s průběžným deficitem a další chystá. Máme tu komplikovanější daňový systém než před čtyřmi lety a stejně vysoké daně z příjmu a stejně vysoké odvody jako na začátku vlády v době hospodářské krize. Máme za sebou čtyři roky represí proti poctivým malým a středním podnikatelům, zároveň ale nové daňové ráje pro několik desítek velkých. A máme tu nízké mzdy, protože vláda neudělala ten nejlogičtější krok: nesnížila daně, abychom mohli mít užitek z ekonomického růstu a abychom ho mohli mít všichni a tedy spravedlivě"
E083F86568E3D0ED7D62D554BF6C941C,"Bohuslav Sobotka místo aby vysvětlil špatně připravený rozpočet své vlády, tak vždy mluví jen o údajných chybách pravicových vlád. Jen si zase nevšiml, že jeho vláda je tu už tři roky a že je za ni plně odpovědný. Ale dobře, zůstaneme u minulosti. ODS se z minulosti poučila a je dobře připravena na budoucnost. Naopak Bohuslav Sobotka se z minulosti nepoučil. Jako premier dělá stejné chyby, které dělal jako ministr financí. Utrácí, zadlužuje, nemyslí na budoucnost. Rozpočet jeho vlády na rok 2017 je rozpočet promarněné příležitosti: investovat, snížit byrokracii, zjednodušit lidem život. Rozpočet bez vize, lhostejný k možnostem České republiky, nudný a nezodpovědný. Nese podpis Andreje Babiše a nepoučitelného socialisty Bohuslava Sobotky. To na žádnou minulou vládu nesvede. Je to jeho odpovědnost."
EC520E391BD3627EF718FFA4554151FB,"Vlastně by nám mělo být Andreje Babiše líto. On jediný  čistý  se musí pohybovat mezi zkorumpovanými politiky a čelit mafiánským praktikám - tradiční strany jsou prostě Palermo, jak nám neohroženě minulý týden sdělil... Ale vážně: Jsem odpůrcem osobních útoků a urážení či pomlouvání politických protivníků. Dávám přednost střetu hodnot, politických programů a nabízených řešení. Ministr financí ale na ODS neustále a nespravedlivě útočí. To si nenecháme líbit. Pokud je totiž v dnešní vrcholné politice někdo, kdo si v uplynulém čtvrtstoletí kvůli svému byznysu podával ruce s kýmkoliv včetně morálně pochybných lidí, je to právě Andrej Babiš. A pokud ho obestírají tak velké nejasnosti kolem finančních transakcí, je na jeho nadřízeném - na premiéru Sobotkovi - aby místo siláckých tweetů něco udělal. Podívejte se na novém videu, jak se na celou věc dívám."
ec6e066941b37484fe0ffe12cdd23fb3,"Přemysl Sobotka. Legenda liberecké, ale i celostátní ODS. Dlouholetý senátor, předseda Senátu, nyní krajský radní pro zdravotnictví. Po letech ve vysoké politice se již rozhodl nepokračovat a užívat si zaslouženého odpočinku.  Dnes jsem mu proto při své návštěvě Libereckého kraje poděkoval za jeho práci pro ODS."
EEEF8DAE75DB656122DAD556564884E4,"Andrej Babiš s oblibou rozhlašuje, že není jako politici  tradičních  stran. To má tedy pravdu. Nedokážu si představit, že by se některý z  tradičních  politiků  mohl takto chovat při  vysvětlování  svých podezřelých finančních transakcí. A to nemluvíme o pár tisících, ale o stovkách milionů korun. Možná to nevysvětlování prochází ministru Babišovi tak snadno proto, že si takové částky většina z nás ani nedovede představit.  Audit, který ministr financí sliboval, nakonec žádným skutečným auditem není. Rozdíly vůči příjmům deklarovaným v majetkových přiznáních odbývá mávnutím ruky a tvrzením, že prostě  účetní udělala chybu . No, možná ano, ale nebyla tou hlavní a podstatnou  chybou  především ona podivná transakce s dluhopisy Agrofertu?   Na pana ministra je, zdá se, jiný metr. Zato jeho ministerstvo financí mezitím zavaluje lidi dalšími kontrolami a pokutami, a to doslova kvůli každé koruně.   Problémy kolem financí A. Babiše se dnes zabýváme v parlamentu. Nemuseli bychom, kdyby premiér Bohuslav Sobotka udělal, co má - jednoznačně a s časovou lhůtou požadoval po svém ministru financí vysvětlení a byl připraven rozhodně jednat. Není to totiž jen problém Andreje Babiše. Je to i problém jeho koaličních partnerů a především premiéra Sobotky."
F37D9E3CCCD3C0AB5E252DDA52017900,"Andrej Babiš nezvládá EET, Bohuslav Sobotka zase Andreje Babiše. Výsledkem je chaos na všech frontách. Více v mém videu."
f7cec565d846f92e9b9b40804b67563c,"Začíná se premiér Bohuslav Sobotka opravdu probouzet? Z Andreje Babiše udělal ministra financí před více než třemi lety - i se všemi pochybnostmi, které už tehdy kolem něj byly. Ani ty další se neobjevily teprve včera: ať už šlo o Čapí hnízdo či podezření na machinace s korunovými dluhopisy. Teď, pár měsíců před volbami a tedy i koncem mandátu této vlády, se podle zpráv z médií Sobotkovi poradci začali zabývat tím, jak Andrej Babiš přišel k Agrofertu. A mezitím se premiér na Twitteru  odvážně  diví, proč finanční správa neprověřovala korunové dluhopisy už dřív, když je Andrej Babiš ministrem od roku 2014... A Bohuslav Sobotka je premiérem jak dlouho? Kdyby nešlo o vládu a spory dvou tak významných představitelů - tedy premiéra a vícepremiéra - bylo by to docela zábavné. Jenže není. Premiér se svou nečinností a váháním sám dostal do kouta. Měl jednat dřív a ne až ve chvíli, kdy jsou volby přede dveřmi."
